id,name,alt_names,state,role,active_years_bce,relations,notes,is_protagonist,birth_year_bce,death_year_bce,short_bio
P_WENJIANG,文姜,夫人姜氏;姜氏;齐子,齐/鲁,齐女、鲁桓公夫人、鲁庄公母,约前709-前673,父齐僖公；兄/异母兄齐襄公诸儿；夫鲁桓公；子鲁庄公同、季友等,传世文献多以礼法和政治危机视角记载；诗经材料属于舆论/文学层。,1,,-673,齐僖公女、鲁桓公夫人、庄公之母；才貌与丑闻并称，桓公死后长期活跃于齐鲁之间。
P_LUHUAN,鲁桓公,公;姬允;姬轨,鲁,鲁国国君,在位前711-前694,鲁惠公子；鲁隐公弟；夫人文姜；子鲁庄公同、庆父、叔牙、季友,由隐公被弑后即位；死于齐，成为齐鲁关系转折点。,1,,-694,弑兄阴影中即位，娶文姜以联齐，终死于齐之车中；一生系于齐鲁强弱之势。
P_QIXIANG,齐襄公,齐侯;姜诸儿;诸儿,齐,齐国国君,在位前697-前686,齐僖公子；齐桓公小白兄；文姜兄/异母兄,与文姜、鲁桓公之死、郑子亹之死、纪国危机和齐国内乱相关。,1,,-686,雄猜暴烈之君，通妹、杀婿、灭纪、迫郑，终死于连称管至父与无知之乱。
P_ZHENGZHAO,郑昭公,公子忽;世子忽;太子忽;郑忽;忽,郑,郑国国君,短暂在位前701；复位前697-前695,郑庄公子；郑厉公突兄；母邓曼；祭仲所立,早年有军功，拒婚文姜；两度失位，后为高渠弥所弑。,1,,-695,有军功而两辞大国之婚，两度为君皆不安其位，终为高渠弥所弑。
P_ZHENGLI,郑厉公,公子突;突,郑,郑国国君/流亡者,前700-前697；复位前680-前673,郑庄公子；郑昭公忽弟；母雍姞,宋国与祭仲推动其首次即位；其出奔使忽复归。,0,,,
P_JIZHONG,祭仲,祭足,郑,郑国权臣,春秋早期,先立忽，后受宋胁迫立突；子亹赴齐时称疾不往,郑国继承危机中的核心权力人物。,0,,,
P_GAOQUMI,高渠弥,高伯,郑,郑国大夫,前707-前694,郑庄公欲任为卿，昭公恶之；弑昭公后相子亹赴齐,被齐襄公车裂/轘。,0,,,
P_ZIWEI,子亹,公子亹;郑子亹,郑,郑国君主,前695-前694,郑庄公子；高渠弥拥立,齐襄公于首止杀之。,0,,,
P_PENGSHENG,公子彭生,彭生,齐,齐国公子/力士,前694,受齐襄公命同乘鲁桓公车；事后被齐杀,鲁桓公之死的直接执行者/替罪者。,0,,,
P_WUZHI,公孙无知,无知;齐无知,齐,齐国公孙、弑君者,前686-前685,与齐襄公早有怨；连称、管至父作乱时被立,弑齐襄公后自立，旋被杀，齐桓公继位前的内乱节点。,0,,,
P_ZHENGZHUANG,郑庄公,寤生;郑伯寤生,郑,郑国国君、周平王卿士,在位前743-前701,父郑武公；母武姜；弟共叔段；子昭公忽、厉公突、子亹、子婴,克段、交质、抗王，郑小霸之主；生年据《史记》武公十四年推为前757。,1,-757,-701,克段安内、繻葛抗王的郑国雄主；庙算深沉，然诸子争位埋下身后大乱。
P_LUYIN,鲁隐公,息姑;公,鲁,鲁国摄政国君,摄位前722-前712,父鲁惠公；母声子；异母弟鲁桓公允,为桓公年少故摄位，《春秋》不书即位；生年不可考。,1,,-712,惠公庶长子，为弟摄政十一年；谦让终不免，死于羽父之谋与新君之默许。
P_WUJIANG,武姜,姜氏,申/郑,郑武公夫人、庄公与段之母,春秋初,申侯女；夫郑武公；子郑庄公、共叔段,恶庄公而爱段，为段请制请京并将启之；城颍之置与黄泉相见后母子如初。,0,,,
P_GONGSHUDUAN,共叔段,太叔段;京城大叔;段,郑,郑国公子、叛乱者,前743-前722后,郑武公子；郑庄公同母弟；子公孙滑,得母宠居京，缮甲治兵将袭郑，败于鄢，出奔共；卒年不详。生年据《史记》武公十七年推为前754。,0,-754,,
P_YINGKAOSHU,颍考叔,,郑,颍谷封人、郑大夫,前722-前712,,以食舍肉感悟庄公，献隧而相见之策；伐许之役先登，被子都自下射死。,0,,-712,
P_YUFU,羽父,公子翚;翚,鲁,鲁国权臣,前722-前711后,,屡帅师专行；如齐逆文姜；请杀桓公求太宰不成，反谮隐公而使贼弑之。,0,,,
P_ZHOUHUAN,周桓王,姬林;桓王,周,周天子,在位前719-前697,周平王孙,不礼郑伯，夺郑伯政，亲率诸侯伐郑，繻葛中箭，王室威严自此大坠。,0,,-697,
P_ZANGXIBO,臧僖伯,公子彄;子臧,鲁,鲁国公族大夫,前722-前718,鲁孝公子；鲁惠公弟,谏隐公观鱼于棠，公不听，称疾不从；卒于隐公五年冬。,0,,-718,
P_ZHUDAN,祝聃,,郑,郑国大夫、将领,前707前后,,繻葛之战射周桓王中肩，请追击而庄公止之；卒年不详。,0,,,
P_ZHENGHUAN,郑桓公,姬友;桓公友,郑,郑国始封君、周司徒,受封前806-前771,周厉王少子；子郑武公,问史伯而谋寄帑贿于虢郐、济洛河颍之间，为郑东迁张本；死于犬戎骊山之难。,0,,-771,
P_LUZHUANG,鲁庄公,同;子同,鲁,鲁国国君,在位前693-前662,父鲁桓公；母文姜；夫人哀姜；子子般、启（闵公）、申（僖公）；兄弟庆父、叔牙、季友,生于前706（关联E004'子同生'）；长勺却齐、乘丘败宋；娶仇家之女哀姜；薨后立嗣之争酿庆父之乱。,1,-706,-662,生于母孽父仇之间，长勺一胜而娶仇女；身后子般被弑，三桓格局萌于其世。
P_QIHUAN,齐桓公,小白;公子小白,齐,齐国国君、春秋首霸,在位前685-前643,父齐僖公；兄齐襄公诸儿；兄弟公子纠；姊妹文姜、宣姜；相管仲,襄公乱后自莒先入得国。本库本期仅收至前679鄄之会始霸，召陵、葵丘等霸业盛期另期展开。,1,,-643,自莒先入得国，释射钩之怨相管仲；柯盟守信，鄄会始霸。
P_GUANZHONG,管仲,管夷吾;仲父,齐,齐国国相,前686-前645,少与鲍叔牙善；先傅公子纠,奉纠奔鲁；《史记》叙其遮莒道射小白中钩；堂阜脱囚后相齐，霸政问对见《国语·齐语》。,0,,-645,
P_BAOSHUYA,鲍叔牙,鲍叔,齐,齐国大夫,前686-前645前后,与管仲少相知；傅公子小白,预见齐乱奉小白奔莒；让相荐管仲——'管夷吾治于高傒，使相可也'。卒年不详。,0,,,
P_SHAOHU,召忽,,齐,公子纠之傅,前686-前685,与管仲同傅公子纠,子纠死，召忽死之；与管仲之生构成士节对照。,0,,-685,
P_ZIJIU,公子纠,子纠,齐,齐国公子,前686-前685,父齐僖公；与小白孰长有异说；傅管仲、召忽,奔鲁争位，乾时战后齐胁鲁杀之于生窦。,0,,-685,
P_CAOGUI,曹刿,曹沫（《史记》作曹沫，是否同一人有异说）,鲁,鲁国士人、将领,前684-前671,,长勺论战'一鼓作气'；谏庄公如齐观社；《史记》柯盟劫桓公者作曹沫，须分层使用。,0,,,
P_AIJIANG,哀姜,夫人姜氏,齐/鲁,齐公室女、鲁庄公夫人,前670-前660,齐公室女（具体世系通说不一）；夫鲁庄公；娣叔姜；与庆父私通,前670入鲁；牵入弑君之乱，齐人杀之于夷，丧至鲁在僖公元年。,0,,-660,
P_QINGFU,庆父,共仲;仲庆父,鲁,鲁国公子、孟氏之祖,前693-前660,鲁桓公子；庄公兄弟；与哀姜私通,使圉人荦弑子般；后再弑闵公，事败缢死（本期仅收至子般之弑）。,0,,-660,
P_JIYOU,季友,成季;公子友,鲁,鲁国公子、季氏之祖,前693-前644,鲁桓公子；庄公弟,受庄公顾命奉子般；子般弑后奔陈，后返鲁定难立僖公。,0,,-644,
P_SHUYA,叔牙,僖叔,鲁,鲁国公子、叔孙氏之祖,前693-前662,鲁桓公子；庄公兄弟,问后时言'庆父材'，季友以君命使其饮鸩，'饮此则有后于鲁国'。,0,,-662,
P_ZIBAN,子般,般;公子般,鲁,鲁国嗣君,前662,父鲁庄公；母孟任,庄公薨后即位，两月内被庆父使圉人荦弑于党氏。,0,,-662,
P_XIPENG,隰朋,,齐,齐国大夫,前685-前645,,管仲临终所荐可任国政者；《史记》记与管仲同年前后卒。,0,,-645,
P_SHUDIAO,竖刁,寺人貂;竖貂,齐,齐国寺人、内宠,前650前后-前643后,,《左传》作寺人貂；桓公卒后与易牙因内宠杀群吏、立无亏。,0,,,
P_YIYA,易牙,雍巫;狄牙,齐,齐国近幸、主膳,前650前后-前643后,,《左传》作雍巫，有宠于卫共姬；与寺人貂共乱齐。,0,,,
P_KAIFANG,开方,公子开方,卫/齐,卫公子、齐近幸,前650前后-前643后,,'三竖'并称见《管子》《史记》层；《左传》僖公十七年之乱未及其名。,0,,,
P_ZAIKONG,宰孔,周公宰孔,周,周王室卿宰,前651前后,,葵丘代王赐胙；先归遇晋侯，断言齐侯不务德而勤远略、其在乱乎。,0,,,
P_QUWAN,屈完,,楚,楚国大夫,前656,,召陵对齐桓：以德绥诸侯谁敢不服；方城为城，汉水为池。,0,,,
P_WEIWEN,卫文公,公子燬;卫侯燬,卫,卫国国君,在位前659-前635,兄卫戴公；许穆夫人为其姊妹（通说）,狄灭卫后受诸侯封于楚丘；大布之衣、大帛之冠，务材训农，卫以中兴。,0,,-635,
P_XUMU,许穆夫人,,卫/许,卫公室女、许穆公夫人、诗人,前660前后,卫公室女；通说戴公、文公之姊妹,闵卫之亡赋《载驰》；后世通说为文学史上最早留名的女诗人。,0,,,
P_QIXI,齐僖公,禄父;禄甫;齐釐公,齐,齐国国君,在位约前730-前698,父齐前庄公（购）；子齐襄公诸儿、齐桓公小白、公子纠；女文姜（嫁鲁桓公）、宣姜（嫁卫宣公，通说）；母弟夷仲年（公孙无知之父，未入库）,齐前庄公之子。起在位年据《史记·齐世家》在位三十三年上推标medium；卒年前698据《春秋·桓公十四年》"齐侯禄父卒"为经文明证。诸子世系（襄公、桓公、纠及女文姜）见左传、史记；宣姜为其女属通说。夷仲年、齐前庄公未入库。,0,,-698,"齐前庄公之子，僖公一朝齐力渐张；亲送女文姜适鲁、乞师于郑而太子忽帅师救齐、两请以女妻忽，皆春秋前期齐鲁郑关系之枢；身后诸子襄公、桓公、纠相继争国。"
