id,ancient_name,state,modern_location,place_type,certainty,description,source_ids,lat,lng,coord_certainty,coord_basis
L_XING,邢,邢,河北省邢台市,诸侯国,high,邢国都；狄患首当其冲，齐桓救之又迁之。,Z033;Z035,37.07,114.50,high,邢国都邢台通说（有葛家庄邢国墓地佐证），据谭其骧《中国历史地图集》
L_YIYI,夷仪,邢,山东省聊城市西南一带，异说,城邑,low,僖公元年邢迁于夷仪，诸侯城之；另有邢台西浆水说。,Z035,36.42,115.90,low,聊城西南说与邢台西说相持，取前说区域近似，据杨伯峻《春秋左传注》
L_CAOYI,曹（漕）邑,卫,河南省滑县旧城一带,城邑,medium,狄灭卫后卫遗民所庐；载驰'言至于漕'即此。,Z034,35.55,114.58,low,滑县旧城说，据杨伯峻《春秋左传注》
L_CHUQIU,楚丘,卫,河南省滑县东,城邑,medium,僖公二年诸侯城楚丘而封卫，卫文公中兴之都（后迁帝丘在本库时段外）。,Z036,35.60,114.78,medium,滑县东通说，据杨伯峻《春秋左传注》
L_SHAOLING,召陵,楚/中原边地,河南省漯河市召陵区,会盟地,high,僖公四年齐率诸侯与楚盟于召陵。,Z037,33.58,114.09,medium,召陵故城在漯河召陵区通说，据谭其骧《中国历史地图集》
L_KUIQIU,葵丘,宋,河南省兰考县至民权县一带，异说,会盟地,medium,僖公九年葵丘之会与盟，齐桓霸业之顶。,Z039,34.90,115.10,low,兰考东/民权东北两说并存，取区域近似，据杨伯峻《春秋左传注》
L_TAO,洮,曹,山东省鄄城县西南一带,会盟地,medium,僖公八年盟于洮，谋王室、定襄王之位。,Z043,35.50,115.42,low,鄄城西南说，据杨伯峻《春秋左传注》
